{
  "$schema": "https://json-schema.org/draft/2020-12/schema",
  "$id": "https://raw.githubusercontent.com/catenahq/catena-templates/main/sources.schema.json",
  "title": "Catena template source",
  "description": "One hand-edited template definition: the Portainer App Template fields a human owns, plus the x-catena extension block carrying everything the Portainer format has no slot for (SSO wiring, bench membership, sizing, bilingual prose). The backup, update and restore declarations live in the compose (block.schema.json). sources/<id>.json is canonical; templates.json, catalog.json, blueprints/ and index.html are generated from it and from the compose block. An entry the registry importer wrote carries x-catena.status \"imported\": it publishes with stubs where a curated entry has hand-written parts, and the published catalog marks it untested.",
  "type": "object",
  "additionalProperties": false,
  "required": [
    "id",
    "type",
    "title",
    "name",
    "categories",
    "platform",
    "x-catena"
  ],
  "properties": {
    "id": {
      "type": "string",
      "pattern": "^[a-z0-9][a-z0-9-]*$",
      "description": "Stable slug. MUST equal the filename stem. Used as the blueprint directory, the sentinel key, and the id every consumer joins on."
    },
    "type": {
      "const": 2,
      "description": "Portainer template type. 2 = swarm stack deployed from a git repository. Every Catena template is a swarm stack: the client host already runs a single-node swarm carrying the catena services, so a compose stack would be a second runtime beside it with none of the placement or restart policy the rest of the box is held to."
    },
    "title": {
      "type": "string",
      "minLength": 1
    },
    "name": {
      "type": "string",
      "pattern": "^[a-z0-9][a-z0-9-]*$",
      "description": "Stack name Portainer prefills on deploy."
    },
    "categories": {
      "type": "array",
      "minItems": 1,
      "items": {
        "type": "string",
        "minLength": 1
      },
      "description": "Filter chips in the Portainer catalog. Descriptive app categories, never internal enums."
    },
    "platform": {
      "enum": [
        "linux",
        "windows"
      ]
    },
    "x-catena": {
      "type": "object",
      "additionalProperties": false,
      "required": [
        "app_name",
        "upstream_url",
        "sso_mode",
        "bench",
        "sizing",
        "en",
        "fr"
      ],
      "properties": {
        "app_name": {
          "type": "string",
          "pattern": "^[a-z0-9][a-z0-9-]*$"
        },
        "status": {
          "const": "imported",
          "description": "Marks an entry build/import_registry.py wrote from a third-party registry and no person has finished. Its bench pack and peak_ram_mb may be null stubs and its prose is the importer's placeholder; the published catalog flags it as untested. A curated entry carries no status."
        },
        "origin": {
          "type": "object",
          "additionalProperties": false,
          "required": [
            "registry",
            "entry",
            "source",
            "licence",
            "attribution"
          ],
          "description": "Where an imported entry's compose file comes from, published with the entry: the registry, the entry's title there, the repository or registry the file is copied from, that source's licence and its copyright notice. It stays once a person finishes the entry.",
          "properties": {
            "registry": {
              "type": "string",
              "minLength": 1
            },
            "entry": {
              "type": "string",
              "minLength": 1
            },
            "source": {
              "type": "string",
              "minLength": 1
            },
            "licence": {
              "type": "string",
              "minLength": 1,
              "description": "SPDX identifier of the source's licence as its forge names it, NOASSERTION when it names none. A record, not a condition."
            },
            "attribution": {
              "type": "string",
              "minLength": 1,
              "description": "The copyright lines of the source's licence file, or the file's or the repository's address when there are none."
            },
            "commit": {
              "type": "string",
              "pattern": "^[0-9a-f]{40}$",
              "description": "The commit of the source the entry was read at."
            },
            "path": {
              "type": "string",
              "minLength": 1,
              "description": "The entry's path in the source at that commit."
            },
            "project": {
              "type": "string",
              "format": "uri",
              "description": "The upstream project's repository, whose licence is the app's and was checked."
            },
            "aliases": {
              "type": "array",
              "description": "Entries of other registries (or the same one) that are this same app: recorded, not imported.",
              "items": {
                "type": "object",
                "additionalProperties": false,
                "required": ["registry", "entry"],
                "properties": {
                  "registry": { "type": "string", "minLength": 1 },
                  "entry": { "type": "string", "minLength": 1 },
                  "source": { "type": "string" },
                  "commit": { "type": "string" },
                  "path": { "type": "string" }
                }
              }
            }
          }
        },
        "pending": {
          "type": "object",
          "additionalProperties": false,
          "required": [
            "findings",
            "to_choose"
          ],
          "description": "What a person still settles before an imported entry is curated: the findings the app checker and the catalog lint leave on its compose file, and the choices the importer cannot make. Only an imported entry carries it.",
          "properties": {
            "findings": {
              "type": "array",
              "items": {
                "type": "string"
              }
            },
            "to_choose": {
              "type": "array",
              "items": {
                "type": "string"
              }
            }
          }
        },
        "upstream_url": {
          "type": "string",
          "format": "uri"
        },
        "requires_catena": {
          "type": "string",
          "pattern": "^[0-9]+\\.[0-9]+\\.[0-9]+$",
          "description": "The oldest Catena release the entry deploys and updates correctly on, for an entry that needs a newer one than some servers run. Its Portainer description and its README name it."
        },
        "logo": {
          "type": "object",
          "additionalProperties": false,
          "required": [
            "source"
          ],
          "description": "Where blueprints/<id>/logo.png comes from. Present exactly when the logo is placed.",
          "properties": {
            "source": {
              "type": "string",
              "format": "uri",
              "description": "The address the picture was taken from, pinned to a commit where it is a repository."
            },
            "notice": {
              "type": "string",
              "minLength": 1,
              "description": "The line the logo owner's terms ask for, printed in the README as written."
            }
          }
        },
        "sso_mode": {
          "enum": [
            "pre-wired",
            "post-deploy-ui",
            "jackson-curl",
            "auto",
            "panel-action",
            "none",
            "n/a"
          ]
        },
        "domain": {
          "type": "object",
          "description": "The web address the application is served at. Absent for an application that has none, which other applications reach inside the server; its block then names version_from.",
          "additionalProperties": false,
          "required": [
            "host",
            "service",
            "port"
          ],
          "properties": {
            "host": {
              "type": "string",
              "minLength": 1
            },
            "service": {
              "type": "string",
              "minLength": 1
            },
            "port": {
              "type": "integer",
              "minimum": 1,
              "maximum": 65535
            }
          }
        },
        "bench": {
          "type": "object",
          "additionalProperties": false,
          "required": [
            "pack"
          ],
          "properties": {
            "pack": {
              "enum": [
                "postgres",
                "mariadb",
                "mongo",
                "nodb",
                "embedded",
                null
              ],
              "description": "null only on an imported entry: it is in no bench pack."
            },
            "fixture": {
              "enum": [
                "required",
                "skip"
              ]
            },
            "hostname_baked": {
              "type": "boolean"
            }
          }
        },
        "sizing": {
          "type": "object",
          "additionalProperties": false,
          "required": [
            "peak_ram_mb"
          ],
          "properties": {
            "idle_ram_mb": {
              "type": [
                "integer",
                "null"
              ],
              "minimum": 1
            },
            "peak_ram_mb": {
              "type": [
                "integer",
                "null"
              ],
              "minimum": 1,
              "description": "Required. The bench scheduler multiplies it by 1.15 to gate slot acquisition. null only on an imported entry, which is not measured yet."
            },
            "idle_cpu_pct": {
              "type": [
                "number",
                "null"
              ],
              "minimum": 0
            },
            "peak_cpu_pct": {
              "type": [
                "number",
                "null"
              ],
              "minimum": 0
            },
            "disk_baseline_mb": {
              "type": [
                "integer",
                "null"
              ],
              "minimum": 1
            },
            "notes": {
              "type": [
                "string",
                "null"
              ]
            },
            "notes_fr": {
              "type": [
                "string",
                "null"
              ]
            }
          }
        },
        "en": {
          "$ref": "#/$defs/prose"
        },
        "fr": {
          "$ref": "#/$defs/prose"
        },
        "env_required_when": {
          "type": "object",
          "description": "Gates an env key on a SIBLING key being non-empty: {\"RELAY_PASSWORD\": \"RELAY_HOST\"} reads \"the relay password is required only when a relay host is configured\". Without it every optional credential is mandatory and the host's marketplace drops the whole template over a value nothing would read. The gate must name a key this template also defines.",
          "additionalProperties": {
            "type": "string",
            "pattern": "^[A-Za-z_][A-Za-z0-9_]*$"
          },
          "propertyNames": {
            "pattern": "^[A-Za-z_][A-Za-z0-9_]*$"
          }
        }
      },
      "dependentRequired": {
        "pending": [
          "status"
        ]
      },
      "if": {
        "required": [
          "status"
        ]
      },
      "then": {
        "required": [
          "origin",
          "pending"
        ]
      },
      "else": {
        "properties": {
          "bench": {
            "properties": {
              "pack": {
                "type": "string"
              }
            }
          },
          "sizing": {
            "properties": {
              "peak_ram_mb": {
                "type": "integer"
              }
            }
          }
        }
      }
    }
  },
  "$defs": {
    "prose": {
      "type": "object",
      "additionalProperties": false,
      "required": [
        "display_name",
        "what_it_is",
        "replaces",
        "compose_description",
        "setup_steps"
      ],
      "properties": {
        "display_name": {
          "type": "string",
          "minLength": 1
        },
        "what_it_is": {
          "type": "string",
          "minLength": 1
        },
        "replaces": {
          "type": "array",
          "items": {
            "type": "string"
          }
        },
        "compose_description": {
          "type": "string",
          "minLength": 1
        },
        "setup_steps": {
          "type": "string"
        },
        "extra_notes": {
          "type": "string"
        }
      }
    }
  }
}
