{
  "id": "immich",
  "type": 2,
  "title": "Immich",
  "name": "catena-immich",
  "categories": [
    "Photos",
    "Files"
  ],
  "platform": "linux",
  "x-catena": {
    "app_name": "catena-immich",
    "upstream_url": "https://immich.app",
    "logo": {
      "source": "https://raw.githubusercontent.com/immich-app/immich/3184b1532fd74a0b777207f8a86e9efe7dafce65/design/immich-logo.svg"
    },
    "sso_mode": "pre-wired",
    "domain": {
      "host": "photos.{{ cloudflare_zone }}",
      "service": "immich-server",
      "port": 2283
    },
    "bench": {
      "pack": "postgres",
      "hostname_baked": false
    },
    "sizing": {
      "idle_ram_mb": null,
      "peak_ram_mb": 2800,
      "idle_cpu_pct": null,
      "peak_cpu_pct": null,
      "disk_baseline_mb": null,
      "notes": "Not yet measured. The peak is an estimate: the machine-learning\nservice loads its search and face models on first use and holds\n1.5 to 2 GB while they are resident, and unloads them after five\nidle minutes. The library grows with the photos and videos\nuploaded, plus roughly 10% for thumbnails and transcodes.",
      "notes_fr": "Pas encore mesur\u00e9. Le pic est une estimation : le service\nd'apprentissage automatique charge ses mod\u00e8les de recherche et de\nvisages \u00e0 la premi\u00e8re utilisation et occupe 1,5 \u00e0 2 Go tant\nqu'ils sont en m\u00e9moire, puis les d\u00e9charge apr\u00e8s cinq minutes\nd'inactivit\u00e9. La biblioth\u00e8que grandit avec les photos et vid\u00e9os\nt\u00e9l\u00e9vers\u00e9es, plus environ 10 % pour les vignettes et transcodages."
    },
    "en": {
      "display_name": "Immich",
      "what_it_is": "Photo and video library with automatic backup from phones, albums, sharing, face recognition and search by content.",
      "replaces": [
        "Google Photos",
        "iCloud Photos",
        "Amazon Photos"
      ],
      "compose_description": "Photo and video library with phone backup. Replaces Google Photos / iCloud Photos.\n\nhttps://github.com/catenahq/catena-templates/blob/main/blueprints/immich/README.md\n",
      "setup_steps": "1. *(Optional)* Keep the library on a separate disk: mount the disk on the server, create a directory on it (for example `/mnt/photos/immich`), and set `UPLOAD_LOCATION` to that path in the **Environment** tab. The directory has to exist before the deploy. Then add the same path under **Settings** -> **Backup** -> extra paths in catena-admin, so the nightly backup includes it.\n2. Click **Deploy**. The first boot takes 2 to 3 minutes while the database initialises. On its first start Immich makes its administrator from the server's admin email (`IMMICH_ADMIN_EMAIL`), with the password `IMMICH_ADMIN_PASSWORD` from the Environment tab.\n3. Wait for the sign-in values. Within a few minutes of the first deploy, the server creates Immich's own sign-in entry in Keycloak, writes its values (`OIDC_CLIENT_ID`, `OIDC_CLIENT_SECRET`, `OIDC_ISSUER_URL`) into the Environment tab, and Immich restarts once and turns on **Sign in with Keycloak**.\n4. Sign in with Keycloak. The server's admin lands in the administrator account, matched by email; everyone else gets an account on their first sign-in. The administrator's password keeps working as a break-glass.\n5. Install the Immich app on each phone, enter the Immich domain as the server address, sign in with Keycloak, and turn on backup.\n",
      "extra_notes": "### Sign-in\n\nImmich keeps its sign-in settings in its own database. On every start it compares them with the sign-in values in the Environment tab and corrects them, signed in as the administrator above. When the first account was created by hand instead, the settings are left as they are: enter the `OIDC_*` values under **Administration** -> **Settings** -> **Authentication Settings** -> **OAuth**, with the scope `openid email profile`.\n\n### Where the library lives\n\nBy default the library is a named volume under `/srv/catena`, which the nightly backup already covers. Setting `UPLOAD_LOCATION` to an absolute path moves it to that directory instead, which is the way to use a larger disk mounted on the server. A path outside `/srv/catena` is backed up only once it is declared in catena-admin under **Settings** -> **Backup** -> extra paths; until then the nightly coverage check reports it as data outside the backup set.\n\n### Machine learning\n\nSearch by content, face recognition and duplicate detection run in the `immich-machine-learning` service. It downloads its models on first use and holds them in memory while they are in use. On a server with little memory, the features can be turned off under **Administration** -> **Settings** -> **Machine Learning Settings**.\n"
    },
    "fr": {
      "display_name": "Immich",
      "what_it_is": "Biblioth\u00e8que de photos et vid\u00e9os avec sauvegarde automatique depuis les t\u00e9l\u00e9phones, albums, partage, reconnaissance des visages et recherche par contenu.",
      "replaces": [
        "Google Photos",
        "Photos iCloud",
        "Amazon Photos"
      ],
      "compose_description": "Biblioth\u00e8que de photos et vid\u00e9os avec sauvegarde des t\u00e9l\u00e9phones. Remplace Google Photos / Photos iCloud.\n\nhttps://github.com/catenahq/catena-templates/blob/main/blueprints/immich/README.md\n",
      "setup_steps": "1. *(Optionnel)* Placez la biblioth\u00e8que sur un disque s\u00e9par\u00e9 : montez le disque sur le serveur, cr\u00e9ez-y un r\u00e9pertoire (par exemple `/mnt/photos/immich`) et indiquez ce chemin dans `UPLOAD_LOCATION` dans l'onglet **Environment**. Le r\u00e9pertoire doit exister avant le d\u00e9ploiement. Ajoutez ensuite le m\u00eame chemin dans catena-admin sous **Settings** -> **Backup** -> chemins suppl\u00e9mentaires, pour que la sauvegarde nocturne l'inclue.\n2. Cliquez **Deploy**. Le premier d\u00e9marrage prend 2 \u00e0 3 minutes, le temps d'initialiser la base de donn\u00e9es. \u00c0 son premier d\u00e9marrage, Immich cr\u00e9e son administrateur avec l'adresse courriel d'administration du serveur (`IMMICH_ADMIN_EMAIL`) et le mot de passe `IMMICH_ADMIN_PASSWORD` de l'onglet Environment.\n3. Attendez les valeurs de connexion. Dans les minutes qui suivent le premier d\u00e9ploiement, le serveur cr\u00e9e l'entr\u00e9e de connexion propre \u00e0 Immich dans Keycloak, inscrit ses valeurs (`OIDC_CLIENT_ID`, `OIDC_CLIENT_SECRET`, `OIDC_ISSUER_URL`) dans l'onglet Environment, et Immich red\u00e9marre une fois puis active **Sign in with Keycloak**.\n4. Connectez-vous avec Keycloak. L'administrateur du serveur arrive dans le compte administrateur, reconnu par son adresse courriel ; les autres personnes re\u00e7oivent un compte \u00e0 leur premi\u00e8re connexion. Le mot de passe de l'administrateur continue de fonctionner comme issue de secours.\n5. Installez l'application Immich sur chaque t\u00e9l\u00e9phone, indiquez le domaine Immich comme adresse du serveur, connectez-vous avec Keycloak et activez la sauvegarde.\n",
      "extra_notes": "### Connexion\n\nImmich garde ses r\u00e9glages de connexion dans sa propre base de donn\u00e9es. \u00c0 chaque d\u00e9marrage, il les compare aux valeurs de connexion de l'onglet Environment et les corrige, connect\u00e9 comme l'administrateur ci-dessus. Si le premier compte a plut\u00f4t \u00e9t\u00e9 cr\u00e9\u00e9 \u00e0 la main, les r\u00e9glages restent tels quels : saisissez les valeurs `OIDC_*` sous **Administration** -> **Settings** -> **Authentication Settings** -> **OAuth**, avec la port\u00e9e `openid email profile`.\n\n### Emplacement de la biblioth\u00e8que\n\nPar d\u00e9faut, la biblioth\u00e8que est un volume nomm\u00e9 sous `/srv/catena`, d\u00e9j\u00e0 couvert par la sauvegarde nocturne. Indiquer un chemin absolu dans `UPLOAD_LOCATION` la place dans ce r\u00e9pertoire, ce qui permet d'utiliser un disque plus grand mont\u00e9 sur le serveur. Un chemin hors de `/srv/catena` n'est sauvegard\u00e9 qu'une fois d\u00e9clar\u00e9 dans catena-admin sous **Settings** -> **Backup** -> chemins suppl\u00e9mentaires ; d'ici l\u00e0, la v\u00e9rification nocturne de couverture le signale comme donn\u00e9es hors de la sauvegarde.\n\n### Apprentissage automatique\n\nLa recherche par contenu, la reconnaissance des visages et la d\u00e9tection des doublons tournent dans le service `immich-machine-learning`. Il t\u00e9l\u00e9charge ses mod\u00e8les \u00e0 la premi\u00e8re utilisation et les garde en m\u00e9moire pendant leur usage. Sur un serveur avec peu de m\u00e9moire, ces fonctions se d\u00e9sactivent sous **Administration** -> **Settings** -> **Machine Learning Settings**.\n"
    }
  }
}
