{
  "id": "rocketchat-oidc",
  "type": 2,
  "title": "Rocket.Chat",
  "name": "catena-rocketchat",
  "categories": [
    "Communication",
    "Chat"
  ],
  "platform": "linux",
  "x-catena": {
    "app_name": "catena-rocketchat",
    "upstream_url": "https://www.rocket.chat/",
    "requires_catena": "0.11.0",
    "sso_mode": "pre-wired",
    "domain": {
      "host": "chat.{{ cloudflare_zone }}",
      "service": "rocketchat",
      "port": 3000
    },
    "bench": {
      "pack": "mongo",
      "hostname_baked": true
    },
    "sizing": {
      "idle_ram_mb": 520,
      "peak_ram_mb": 720,
      "idle_cpu_pct": 3,
      "peak_cpu_pct": 35,
      "disk_baseline_mb": 180,
      "notes": "MongoDB replica set + Rocket.Chat node process. MongoDB's WiredTiger\ncache is the dominant cost; default settings fit comfortably on the\n6 GB starting tier.",
      "notes_fr": "Le replica set MongoDB + le process Node Rocket.Chat. Le cache\nWiredTiger de MongoDB domine ; les r\u00e9glages par d\u00e9faut tiennent\nsans difficult\u00e9 sur le palier de d\u00e9part 6 Go."
    },
    "en": {
      "display_name": "Rocket.Chat",
      "what_it_is": "Team chat -- channels, direct messages, file sharing, mobile apps, and video calls. Keycloak SSO pre-wired.",
      "replaces": [
        "Slack",
        "Microsoft Teams",
        "Discord (for work)"
      ],
      "compose_description": "Team chat + video. Keycloak SSO pre-wired. Replaces Slack / Microsoft Teams.\n\nhttps://github.com/catenahq/catena-templates/blob/main/blueprints/rocketchat-oidc/README.md\n",
      "setup_steps": "1. Click **Deploy**. Nothing to fill in the Environment tab except a different hostname, where one is wanted.\n2. Wait for the sign-in values. Within a few minutes of the first deploy, the server creates Rocket.Chat's own sign-in entry in Keycloak, writes its values (`OIDC_CLIENT_ID`, `OIDC_CLIENT_SECRET`, `OIDC_ISSUER_URL`) into the Environment tab, and Rocket.Chat restarts once with them. The login page then shows **Sign in with Keycloak**.\n3. Sign in with Keycloak. The workspace administrator is the account made on the first start with the server's admin email (`ADMIN_EMAIL`): that person's Keycloak sign-in opens it. Everyone else gets an account on their first sign-in.\n4. *(Optional, ~30 s)* Attach Nextcloud files in chats: Administration -> Apps -> Marketplace -> search `Nextcloud` -> install -> set the Nextcloud domain in the app settings. Users can then type `/nextcloud` in any chat to browse and attach files.\n",
      "extra_notes": "### Mobile apps\n\nRocket.Chat's iOS and Android apps connect straight to the server. Users paste `https://chat.<your-domain>` into the app on first launch and sign in via Keycloak.\n\n### Emailed sign-in codes\n\nAn account that signs in with Keycloak gets no emailed code from Rocket.Chat: Keycloak's sign-in and its own second factor are the check. You can turn emailed codes back on for those accounts under **Administration** -> **Settings** -> **Accounts** -> **Two Factor Authentication** -> **Make two factor via email available for oAuth users**; your choice stays across restarts and updates.\n"
    },
    "fr": {
      "display_name": "Rocket.Chat",
      "what_it_is": "Messagerie d'\u00e9quipe -- canaux, messages directs, partage de fichiers, apps mobiles, appels vid\u00e9o. Keycloak SSO pr\u00e9-c\u00e2bl\u00e9.",
      "replaces": [
        "Slack",
        "Microsoft Teams",
        "Discord (en usage pro)"
      ],
      "compose_description": "Messagerie d'\u00e9quipe + vid\u00e9o. Keycloak SSO pr\u00e9-c\u00e2bl\u00e9. Remplace Slack / Microsoft Teams.\n\nhttps://github.com/catenahq/catena-templates/blob/main/blueprints/rocketchat-oidc/README.md\n",
      "setup_steps": "1. Cliquez **Deploy**. Rien \u00e0 remplir dans l'onglet Environment, sauf un autre nom de domaine le cas \u00e9ch\u00e9ant.\n2. Attendez les valeurs de connexion. Dans les minutes qui suivent le premier d\u00e9ploiement, le serveur cr\u00e9e l'entr\u00e9e de connexion propre \u00e0 Rocket.Chat dans Keycloak, inscrit ses valeurs (`OIDC_CLIENT_ID`, `OIDC_CLIENT_SECRET`, `OIDC_ISSUER_URL`) dans l'onglet Environment, et Rocket.Chat red\u00e9marre une fois avec elles. La page de connexion affiche alors **Sign in with Keycloak**.\n3. Connectez-vous avec Keycloak. L'administrateur de l'espace de travail est le compte cr\u00e9\u00e9 au premier d\u00e9marrage avec l'adresse courriel d'administration du serveur (`ADMIN_EMAIL`) : la connexion Keycloak de cette personne l'ouvre. Les autres personnes re\u00e7oivent un compte \u00e0 leur premi\u00e8re connexion.\n4. *(Optionnel, ~30 s)* Joindre des fichiers Nextcloud : Administration -> Apps -> Marketplace -> cherchez `Nextcloud` -> installez -> indiquez le domaine Nextcloud. Les utilisateurs tapent ensuite `/nextcloud` dans un chat pour parcourir et joindre des fichiers.\n",
      "extra_notes": "### Applications mobiles\n\nLes apps iOS et Android de Rocket.Chat se connectent directement au serveur. Les utilisateurs collent `https://chat.<votre-domaine>` au premier lancement et se connectent via Keycloak.\n\n### Codes de connexion par courriel\n\nUn compte qui se connecte avec Keycloak ne re\u00e7oit aucun code par courriel de Rocket.Chat : la connexion Keycloak et son propre second facteur font la v\u00e9rification. Vous pouvez r\u00e9activer les codes par courriel pour ces comptes dans **Administration** -> **Settings** -> **Accounts** -> **Two Factor Authentication** -> **Make two factor via email available for oAuth users** ; votre choix est conserv\u00e9 lors des red\u00e9marrages et des mises \u00e0 jour.\n"
    }
  }
}
