{
  "id": "twenty",
  "type": 2,
  "title": "Twenty",
  "name": "catena-twenty",
  "categories": [
    "CRM",
    "Business"
  ],
  "platform": "linux",
  "x-catena": {
    "app_name": "catena-twenty",
    "upstream_url": "https://twenty.com/",
    "sso_mode": "none",
    "domain": {
      "host": "twenty.{{ cloudflare_zone }}",
      "service": "server",
      "port": 3000
    },
    "bench": {
      "pack": "postgres",
      "hostname_baked": true
    },
    "sizing": {
      "idle_ram_mb": 580,
      "peak_ram_mb": 920,
      "idle_cpu_pct": 4,
      "peak_cpu_pct": 55,
      "disk_baseline_mb": 220,
      "notes": "Server + worker + Postgres + Redis -- four containers; idle RAM is\nhigher than EspoCRM. Choose Twenty for the modern UI; choose\nEspoCRM for tighter footprint.",
      "notes_fr": "Server + worker + Postgres + Redis -- quatre conteneurs ; RAM au\nrepos plus \u00e9lev\u00e9e qu'EspoCRM. Choisissez Twenty pour l'UI\nmoderne ; EspoCRM pour l'empreinte plus l\u00e9g\u00e8re."
    },
    "en": {
      "display_name": "Twenty",
      "what_it_is": "Modern open-source CRM. Contacts, companies, opportunities, email sync, pipelines. Alternative to EspoCRM (the default CRM).",
      "replaces": [
        "Salesforce",
        "HubSpot",
        "Pipedrive"
      ],
      "compose_description": "Modern open-source CRM (alternative to EspoCRM). Replaces Salesforce / HubSpot.\n\nhttps://github.com/catenahq/catena-templates/blob/main/blueprints/twenty/README.md\n",
      "setup_steps": "1. Click **Deploy**. Wait ~1 min.\n2. Visit the Twenty domain and sign up to create the initial workspace + admin user. Twenty keeps its own login: single sign-on is in its paid editions only.\n",
      "extra_notes": "**EspoCRM vs Twenty.** EspoCRM is the suite's default CRM (mature, native OIDC, mobile apps). Twenty is offered as an alternative for clients who prefer its Notion-style UI; both can be deployed side-by-side. The default `crm.<your-domain>` host is reserved for EspoCRM -- Twenty defaults to `twenty.<your-domain>`.\n"
    },
    "fr": {
      "display_name": "Twenty",
      "what_it_is": "CRM moderne open-source. Contacts, entreprises, opportunit\u00e9s, synchronisation email, pipelines. Alternative \u00e0 EspoCRM (le CRM par d\u00e9faut).",
      "replaces": [
        "Salesforce",
        "HubSpot",
        "Pipedrive"
      ],
      "compose_description": "CRM moderne open-source (alternative \u00e0 EspoCRM). Remplace Salesforce / HubSpot.\n\nhttps://github.com/catenahq/catena-templates/blob/main/blueprints/twenty/README.md\n",
      "setup_steps": "1. Cliquez **Deploy**. Patientez ~1 min.\n2. Visitez le domaine Twenty et cr\u00e9ez le compte initial (workspace + admin). Twenty garde sa propre connexion : l'authentification unique n'existe que dans ses \u00e9ditions payantes.\n",
      "extra_notes": "**EspoCRM vs Twenty.** EspoCRM est le CRM par d\u00e9faut de la suite (mature, OIDC natif, apps mobiles). Twenty est offert comme alternative pour les clients qui pr\u00e9f\u00e8rent son UI fa\u00e7on Notion ; les deux peuvent cohabiter. Le domaine par d\u00e9faut `crm.<votre-domaine>` est r\u00e9serv\u00e9 \u00e0 EspoCRM -- Twenty utilise par d\u00e9faut `twenty.<votre-domaine>`.\n"
    }
  }
}
