{
  "id": "element",
  "type": 2,
  "title": "Element / Matrix",
  "name": "catena-element",
  "categories": [
    "Communication",
    "Chat"
  ],
  "platform": "linux",
  "x-catena": {
    "app_name": "catena-element",
    "upstream_url": "https://element.io/",
    "requires_catena": "0.11.0",
    "sso_mode": "pre-wired",
    "domain": {
      "host": "element.{{ cloudflare_zone }}",
      "service": "element-web",
      "port": 80
    },
    "bench": {
      "pack": "postgres",
      "hostname_baked": true
    },
    "sizing": {
      "idle_ram_mb": null,
      "peak_ram_mb": 1536,
      "idle_cpu_pct": null,
      "peak_cpu_pct": null,
      "disk_baseline_mb": null,
      "notes": "Element (Synapse + Postgres + Redis) is memory-hungry during the\nfirst federation sync; the value above is a launch-day floor.\nConservative pre-launch estimate, not yet a measured value.",
      "notes_fr": "Element (Synapse + Postgres + Redis) consomme beaucoup de m\u00e9moire\nlors de la premi\u00e8re synchronisation f\u00e9d\u00e9r\u00e9e ; la valeur ci-dessus\nest un plancher de mise en service. Estimation prudente\npr\u00e9-lancement, pas encore une mesure r\u00e9elle."
    },
    "en": {
      "display_name": "Element / Matrix",
      "what_it_is": "Self-hosted Element + Matrix homeserver -- federated-capable team chat with end-to-end encryption, voice and group video (bundled Jitsi).",
      "replaces": [
        "Slack",
        "Microsoft Teams",
        "Signal (for team use)",
        "Zoom (for small group calls)"
      ],
      "compose_description": "Element + Matrix homeserver. Chat (E2EE), voice, group video. Keycloak SSO pre-wired. Federation off by default.\n\nhttps://github.com/catenahq/catena-templates/blob/main/blueprints/element/README.md\n",
      "setup_steps": "1. Click **Deploy**. First boot takes ~3 minutes (Synapse generates signing keys, postgres initialises, Jitsi components register). Within a few minutes of the first deploy, the server creates Element's own sign-in entry in Keycloak, writes its values (`OIDC_CLIENT_ID`, `OIDC_CLIENT_SECRET`, `OIDC_ISSUER_URL`) into the Environment tab, and the homeserver restarts once with them.\n2. Open `element.<your-domain>` -- the Element web client opens. Click **Sign in with Keycloak**.\n3. The first Keycloak user lands as a regular Matrix user. To promote them to homeserver admin, open `synapseadmin.<your-domain>` (admins only, gated by the Keycloak admin group), find the user, and toggle the admin flag.\n4. *(Optional)* Open federation: edit `FEDERATION_DOMAIN_WHITELIST` in the Environment tab (e.g. `\"matrix.org\",\"example.com\"`) and redeploy. Default is empty (no federation -- the homeserver only talks to itself).\n",
      "extra_notes": "### End-to-end encryption\n\nNew direct messages and new invite-only rooms are encrypted by default. Public rooms stay unencrypted (E2EE in large public rooms hurts mobile sync UX). Each user is prompted to set up **Secure Backup** the first time they log in -- this is a 24-character recovery key that lets them read encrypted history from a new device. Losing the key locks the user out of old encrypted messages, so it deserves the same care as a password-manager vault key.\n\n### Voice and video\n\n- **1:1 calls** use the bundled Element/Matrix call stack. When this server runs the call relay (a separate application of the catalog), calls from behind a restrictive network go through it; without it they connect directly.\n- **Group video calls** open in an embedded Jitsi widget at `elementmeet.<your-domain>` (the bundled Jitsi instance). Calls never leave the server -- there is no fallback to `meet.jit.si`.\n\n### Mobile apps\n\nElement's iOS and Android apps connect straight to the homeserver. Users tap **Use custom server** at first launch and enter `matrix.<your-domain>`. SSO via Keycloak works in-app.\n"
    },
    "fr": {
      "display_name": "Element / Matrix",
      "what_it_is": "Element + serveur Matrix auto-h\u00e9berg\u00e9s -- messagerie d'\u00e9quipe avec chiffrement de bout en bout, voix et visio de groupe (Jitsi embarqu\u00e9). F\u00e9d\u00e9ration capable mais d\u00e9sactiv\u00e9e par d\u00e9faut.",
      "replaces": [
        "Slack",
        "Microsoft Teams",
        "Signal (en usage pro)",
        "Zoom (pour les petits appels de groupe)"
      ],
      "compose_description": "Element + serveur Matrix. Chat (E2EE), voix, visio de groupe. SSO Keycloak pr\u00e9-c\u00e2bl\u00e9. F\u00e9d\u00e9ration d\u00e9sactiv\u00e9e par d\u00e9faut.\n\nhttps://github.com/catenahq/catena-templates/blob/main/blueprints/element/README.md\n",
      "setup_steps": "1. Cliquez **Deploy**. Le premier d\u00e9marrage prend ~3 min (Synapse g\u00e9n\u00e8re ses cl\u00e9s de signature, postgres s'initialise, les composants Jitsi s'enregistrent). Dans les minutes qui suivent le premier d\u00e9ploiement, le serveur cr\u00e9e l'entr\u00e9e de connexion propre \u00e0 Element dans Keycloak, inscrit ses valeurs (`OIDC_CLIENT_ID`, `OIDC_CLIENT_SECRET`, `OIDC_ISSUER_URL`) dans l'onglet Environment, et le homeserver red\u00e9marre une fois avec elles.\n2. Ouvrez `element.<votre-domaine>` -- le client web Element s'ouvre. Cliquez **Se connecter avec Keycloak**.\n3. Le premier utilisateur Keycloak arrive comme utilisateur Matrix normal. Pour le promouvoir admin du homeserver, ouvrez `synapseadmin.<votre-domaine>` (r\u00e9serv\u00e9 aux administrateurs, prot\u00e9g\u00e9 par le groupe admin Keycloak), trouvez l'utilisateur, et activez l'indicateur admin.\n4. *(Optionnel)* Ouvrez la f\u00e9d\u00e9ration : \u00e9ditez `FEDERATION_DOMAIN_WHITELIST` dans l'onglet Environment (ex : `\"matrix.org\",\"example.com\"`) puis red\u00e9ployez. Par d\u00e9faut vide (pas de f\u00e9d\u00e9ration -- le homeserver ne parle qu'\u00e0 lui-m\u00eame).\n",
      "extra_notes": "### Chiffrement de bout en bout\n\nLes nouveaux messages directs et les nouveaux salons sur invitation sont chiffr\u00e9s par d\u00e9faut. Les salons publics restent en clair (le E2EE dans des salons publics nombreux d\u00e9grade la synchro mobile). Chaque utilisateur est invit\u00e9 \u00e0 configurer le **Coffre-fort de r\u00e9cup\u00e9ration** lors de sa premi\u00e8re connexion -- une cl\u00e9 de 24 caract\u00e8res qui lui permet de lire l'historique chiffr\u00e9 depuis un nouvel appareil. Perdre la cl\u00e9 verrouille l'utilisateur hors de ses anciens messages chiffr\u00e9s ; sauvegardez-la comme un mot de passe ma\u00eetre.\n\n### Voix et vid\u00e9o\n\n- **Appels 1:1** utilisent le moteur d'appel Element/Matrix. Quand ce serveur ex\u00e9cute le relais d'appels (une application distincte du catalogue), les appels depuis un r\u00e9seau restrictif passent par lui ; sans lui, ils se connectent directement.\n- **Appels de groupe** s'ouvrent dans un widget Jitsi embarqu\u00e9 sur `elementmeet.<votre-domaine>` (l'instance Jitsi embarqu\u00e9e). Les appels ne quittent jamais le serveur -- pas de repli sur `meet.jit.si`.\n\n### Applications mobiles\n\nLes apps iOS et Android d'Element se connectent directement au homeserver. Les utilisateurs touchent **Utiliser un serveur personnalis\u00e9** au premier lancement et saisissent `matrix.<votre-domaine>`. La connexion via Keycloak fonctionne dans l'app.\n"
    }
  }
}
